{
  "id": "20261018-0202-feat-moderation-5931",
  "continues": null,
  "agent": "claude-code",
  "model": "",
  "human": "Eileen Luo",
  "branch": "feat/moderation",
  "base": "1795ce9",
  "worktree": "/Users/home/Desktop/repositories/oraclehackathon26/momo-moderation",
  "started": "2026-10-18T07:02:58.167Z",
  "ended": "2026-10-18T07:40:00.000Z",
  "status": "done",
  "goal": "Daily AI moderation reports, .edu email verification at sign-up, admin-only Reports dashboard with emailed sign-in codes",
  "summary": "Sign-up now needs a verified .edu email: RegisterPanel asks for name + school email, POST /api/auth/email/start emails a 6-digit code (lib/email-codes.ts, HMAC-hashed in email_codes, 10 min, 5 tries), /api/auth/email/verify returns a signed token (lib/verified-email.ts) that POST /api/users requires; the address is stored in users.email, never returned. Daily cron /api/cron/moderate (04:00 UTC, before expire-groups) runs lib/moderation.ts: gathers usernames, group names, the last 24h of chat and recently updated notes into one document (archived to moderation/<date>.json), sends it in 12k-char chunks to OCI GenAI with an Orbit-specific moderator preamble, and stores flags in moderation_reports (deduped by a hash of the flagged text). Keyword fallback when GenAI is unset. /admin: email-code sign-in for ADMIN_EMAILS (default eluo.5230@gmail.com), HttpOnly signed 8h cookie, then a 'Reports' list (Category | Summary rows that expand to severity, reason, flagged text, author, room, times and a /g/<room> link). Mail goes over SMTP (nodemailer); with SMTP unset codes print to the server log.",
  "claims": [
    "lib/moderation.ts",
    "lib/email.ts",
    "lib/email-codes.ts",
    "lib/tokens.ts",
    "lib/verified-email.ts",
    "lib/admin.ts",
    "app/admin/**",
    "components/admin/**",
    "app/api/admin/**",
    "app/api/auth/**",
    "app/api/cron/moderate/**",
    "app/api/users/route.ts",
    "lib/store/**",
    "lib/types.ts",
    "lib/schemas.ts",
    "db/schema.sql",
    "scripts/migrate.ts",
    "vercel.json",
    "components/auth/AuthWindow.tsx",
    "components/auth/AuthGate.tsx",
    "components/auth/Welcome.tsx",
    "lib/client/profile.ts",
    ".env.example",
    "package.json"
  ],
  "files_touched": [],
  "commits": [],
  "uncommitted": false,
  "decisions": [
    {
      "what": "Codes stored hashed in the DB (email_codes) rather than stateless signed challenges",
      "why": "Attempt counting has to survive across serverless instances; the in-process rate limiter alone can't stop brute force of a 6-digit code."
    },
    {
      "what": "Reports deduped by sha256(category|item identity|text)",
      "why": "Usernames and group names are re-reviewed every night; the same text should be reported once, but a renamed user is reviewed again."
    },
    {
      "what": "Moderation runs in its own cron at 04:00 UTC, not inside expire-groups",
      "why": "expire-groups (09:00 UTC) deletes emptied rooms with their chat and notes; review has to see them first. 04:00 UTC is ~11 PM Nashville, i.e. end of day."
    },
    {
      "what": "Username reports link to the user's current room; no new profile URL",
      "why": "User asked not to create new link types; /g/<name> is the only item page."
    },
    {
      "what": "Email is not unique and there is no email login",
      "why": "Out of scope; unique emails without email login would lock out anyone who loses their browser profile."
    }
  ],
  "verification": {
    "typecheck": "pass",
    "lint": "pass",
    "build": "not run",
    "manual": "Local dev on the memory store with real OCI GenAI: non-.edu rejected, wrong/reused code and tampered token rejected, full sign-up through the UI; moderation cron reviewed 99 items and flagged 6 planted ones (gift-card scam, selling answers, doxxing, prompt injection, cheating group name, scam username) and skipped benign 'this exam is going to kill me lol'; a rerun added 0. /admin: unauth and forged cookie 401, non-admin email gets no code, sign-in with code shows Reports, rows expand with the room link; checked at 375px. Oracle store code NOT run: the shared DB doesn't have the new tables yet."
  },
  "next_steps": [
    "Apply the schema to the shared DB (one person, after review): npm run db:migrate -- --upgrade. Until then, sign-up and the moderation cron fail on the Oracle store.",
    "Set on Vercel: AUTH_SECRET, SMTP_HOST/SMTP_PORT/SMTP_USER/SMTP_PASSWORD, EMAIL_FROM (OCI Email Delivery needs an approved sender), optionally ADMIN_EMAILS.",
    "After deploy, trigger /api/cron/moderate once with the cron secret and check /admin."
  ],
  "open_questions": [
    "Should a verified .edu email also let people log back in on a new device (email login)?"
  ],
  "blockers": [],
  "conflict_notes": [
    "components/auth/AuthWindow.tsx RegisterPanel was rewritten (email + code step); AuthGate passes a VerifiedEmail to Welcome. Store interface gained saveEmailCode/checkEmailCode/addReports/listReports and createUser takes an email argument."
  ]
}
